{"model":{"id":"TID-CMM","name":"Threat-Informed Detection Capability Maturity Model","short_name":"TID-CMM","version":"1.6.0","documents_version":"1.6","site_updated":"2026-09-07","released":"2026-09-06","originated":"2022","first_published":"2026-08-10","author":"Reza Adineh","slogan":"Think smarter, Stay Secure","homepage":"https://tid-cmm.com","repository":"https://github.com/ReZaAdineH/tid-cmm","contact":"hello@tid-cmm.com","licence":"https://tid-cmm.com/licence/","licensing":{"terms_url":"https://tid-cmm.com/licence/","summary":"Free to use under the permissions at https://tid-cmm.com/licence/. Not open source, not public domain, and not licensed for redistribution, rebranding or derivative products. Republishing, adapting or embedding the model or the datasets requires written permission. MITRE ATT&CK content remains (C) The MITRE Corporation under MITRE's own terms.","open_source":false,"model_and_data":"Permitted use as stated at https://tid-cmm.com/licence/","assessment_tool":"Free to use for any purpose including commercial assessment work. Not open source; not licensed for redistribution or derivative tooling.\n","third_party":"MITRE ATT&CK content (C) The MITRE Corporation, under MITRE's Terms of Use.","earlier_versions":"Model 1.5.0 and documents v1.4 were released under CC-BY-4.0 and keep that licence."},"abstract":"TID-CMM measures whether an organisation's detection capability is genuinely driven by adversary behaviour, and whether that capability has been proven to work. It scores eight domains from 0 to 5, anchors coverage claims to MITRE ATT&CK at technique level, and separates evidence from assertion: a technique's detection is evidenced (status 2) only when a deployed and enabled detection is recorded with healthy required telemetry and a named artefact, and locally validated (status 3) only when that detection has additionally been shown to fire, inside the stated window, by a qualifying controlled adversarial method. High-fidelity detection means covering the context-rich, high-impact threats first; identifying those requires mapping the attack surface and building attack trees to crown jewels. Per-technique detection does not by itself prove multi-step scenario coverage: a technique detection that does not contribute to narrating a full attack scenario is telemetry, not defence.\n","positioning":"TID-CMM operates within UTIOM (the Unified Threat-Informed Operations Model, utiom doctrine: everything in the SOC is Incident Response). Detection is the first phase of IR; TID-CMM measures how mature and ready that phase is. It is deliberately partial on the later IR phases — containment, recovery and crisis management are UTIOM's territory — which is why the IR domain carries a deliberately modest weight here. The model is technology-agnostic: no level requires a specific product, agent or analytic technique. It applies equally to cloud (AWS, Azure, GCP), SaaS, on-premises and hybrid estates, with or without EDR; what changes per environment is which telemetry is crucial, and the tooling advises on that from ATT&CK data-component mappings.\n"},"alignment":{"attack":{"framework":"MITRE ATT&CK Enterprise","version":"19.2","snapshot_date":"2026-08-05","techniques":697,"parent_techniques":222,"sub_techniques":475,"tactics":15,"data_components":109},"crosswalks":[{"id":"nist-csf-2.0","name":"NIST Cybersecurity Framework 2.0","key":"nist_csf_2","relationship":"formal_crosswalk","coverage":"all_sub_capabilities"},{"id":"soc-cmm","name":"SOC-CMM v2.x","key":"soc_cmm","relationship":"formal_crosswalk","coverage":"all_sub_capabilities"}],"comparative":[{"id":"iso-27001-2022","name":"ISO/IEC 27001:2022 Annex A","key":"iso_27001_2022","relationship":"referenced","note":"Referenced where explicitly mapped; currently TI.1 / A.5.7."},{"id":"ctem","name":"Gartner Continuous Threat Exposure Management","key":"ctem","relationship":"positioning","note":"CTEM asks whether an exposure is exploitable; TID-CMM asks whether the exploitation would be seen."},{"id":"debmm","name":"Elastic Detection Engineering Behavior Maturity Model","key":"debmm","relationship":"positioning","note":"DEBMM covers engineering practice; TID-CMM covers whether that practice is aimed at the right adversary and proven against them."},{"id":"mitre-engage","name":"MITRE Engage","key":"mitre_engage","relationship":"referenced","note":"Supplies the placement and operationalisation vocabulary used by AA.7."},{"id":"mitre-d3fend","name":"MITRE D3FEND","key":"d3fend","relationship":"not_mapped","note":"Listed in earlier releases as a crosswalk. No sub-capability carries a D3FEND mapping, so it is recorded here as unmapped rather than claimed."}]},"levels":[{"value":0,"key":"absent","name":"Absent","summary":"The capability does not exist in any recognisable form.","evidence_bar":"Nothing to show."},{"value":1,"key":"ad_hoc","name":"Ad hoc","summary":"Happens occasionally, driven by individual initiative or an incident. Undocumented, unrepeatable, lost when the individual leaves.\n","evidence_bar":"Anecdote, a person who \"knows how\"."},{"value":2,"key":"repeatable","name":"Repeatable","summary":"Documented and consistently performed, but driven by compliance, tooling defaults or vendor content rather than by adversary behaviour.\n","evidence_bar":"A written procedure and proof it was followed more than once."},{"value":3,"key":"threat_informed","name":"Threat-Informed","summary":"Driven by a prioritised adversary profile. Work is explicitly mapped to ATT&CK techniques and traceable back to an intelligence requirement or a threat model.\n","evidence_bar":"ATT&CK-mapped artefacts with traceability to a threat driver."},{"value":4,"key":"validated","name":"Measured & Validated","summary":"Quantitatively managed and independently proven. Claims are tested by emulation, results are measured over time, and gaps enter a managed backlog.\n","evidence_bar":"Test results, trended metrics, closed-loop backlog records."},{"value":5,"key":"adaptive","name":"Adaptive","summary":"A self-correcting closed loop. Change in the threat landscape automatically produces changes in telemetry, detection and validation, with measured cycle time. The organisation contributes findings back to the community.\n","evidence_bar":"Automated pipeline metrics, cycle-time trends, external contributions."}],"scoring":{"subcapability_score":"Integer 0-5, or 'NA' if formally scoped out.","domain_score":"Weighted mean of in-scope sub-capability scores, using sub-capability weights.","overall_score":"Weighted mean of domain scores using domain weights. Reported to 2 decimals.","maturity_band":[{"min":0.0,"max":0.99,"band":"Level 0 — Absent"},{"min":1.0,"max":1.99,"band":"Level 1 — Ad hoc"},{"min":2.0,"max":2.99,"band":"Level 2 — Repeatable"},{"min":3.0,"max":3.99,"band":"Level 3 — Threat-Informed"},{"min":4.0,"max":4.99,"band":"Level 4 — Measured & Validated"},{"min":5.0,"max":5.0,"band":"Level 5 — Adaptive"}],"constraints":[{"id":"C1","name":"Validation ceiling","rule":"No domain may be scored above the AV domain score + 1. You cannot claim measured, validated detection engineering if you have never emulated an adversary against it.\n"},{"id":"C2","name":"Visibility ceiling","rule":"DE (Detection Engineering) may not exceed DC (Telemetry & Detection Coverage) + 1. Detection logic cannot be more mature than the telemetry it runs on.\n"},{"id":"C3","name":"Evidence rule","rule":"Any score of 4 or 5 requires a named artefact recorded in the evidence field. In strict mode, a recorded score of 4 or 5 without a named artefact is counted as 3.\n"},{"id":"C4","name":"Intent ceiling","rule":"DC and DE may not exceed max(TI, TM) + 1. Telemetry and detection content cannot be more mature than the strategy directing them. Sensors without architectural intent produce noise, not defence.\n"},{"id":"C5","name":"Inherited intent ceiling","applies_to":"TI.2","ceiling":2,"rule":"TI.2 may not exceed level 2 where the adversary set was accepted from the tool's suggested threat profile without modification. Accepting it unchanged means the question TI.2 asks — who are you defending against, and how do you know? — was answered by the tool, not by you. Reviewing the set lifts the ceiling: add an actor, remove one, or record why one was excluded.\n","why":"A suggested profile makes the hardest step in an assessment tractable, which is why it is offered. But a model that supplies its own answer and then scores you on it is grading its own homework, and every other constraint here exists to prevent exactly that. This ceiling lets the suggestion be useful without becoming a way to score threat intelligence maturity nobody has.\n","lifted_by":"Any modification to the suggested set, or a recorded rationale for accepting it unchanged.\n"}],"coverage_score":{"name":"ATT&CK Validated Coverage Score (VCS)","formula":"For each in-scope technique: 0 = no telemetry, 1 = telemetry only, 2 = detection logic exists, 3 = detection validated by emulation within the review period. VCS = sum(actual) / (3 * count(in-scope)) expressed as a percentage. Report alongside, never instead of, the domain scores.\n","note":"In-scope techniques are those relevant to the organisation's platforms and prioritised threat profile — not all 697. Reporting coverage against the full ATT&CK matrix is a vanity metric.\n"},"scenario_coverage":{"name":"Scenario Coverage Score (SCS)","principle":"A technique detection that does not contribute to narrating a full attack scenario is telemetry, not defence. A login attempt means nothing on its own; a login attempt on the path to a crown jewel, correlated with the steps before and after it, is a detection. Technique-level VCS is an early-maturity metric; scenario coverage is the mature one.\n","formula":"For each prioritised attack scenario (an attack tree or emulation chain to a named crown-jewel objective): the scenario counts as covered when the chain would be detected at two or more distinct kil